{
  "$schema": "https://json-schema.org/draft/2020-12/schema",
  "$id": "urn:agent-dispatch:schema:work-receipt:v2",
  "title": "Agent Dispatch WorkReceipt v2",
  "type": "object",
  "additionalProperties": false,
  "required": [
    "schema_version",
    "dispatch_id",
    "run_id",
    "resource_id",
    "status",
    "submitted_at",
    "changes"
  ],
  "properties": {
    "schema_version": {
      "enum": [
        "agent-dispatch.work-receipt/v1",
        "agent-dispatch.work-receipt/v2"
      ]
    },
    "dispatch_id": {
      "type": "string"
    },
    "external_task_id": {
      "type": [
        "string",
        "null"
      ]
    },
    "run_id": {
      "type": "string",
      "minLength": 1
    },
    "resource_id": {
      "type": "string"
    },
    "status": {
      "enum": [
        "begun",
        "completed",
        "partially_completed",
        "blocked",
        "failed"
      ]
    },
    "base_revision": {
      "type": [
        "string",
        "null"
      ]
    },
    "result_revision": {
      "type": [
        "string",
        "null"
      ]
    },
    "submitted_at": {
      "type": "string",
      "format": "date-time"
    },
    "changes": {
      "type": "array",
      "maxItems": 1000,
      "items": {
        "type": "object",
        "additionalProperties": false,
        "required": [
          "path"
        ],
        "properties": {
          "path": {
            "type": "string",
            "minLength": 1
          },
          "before_digest": {
            "type": [
              "string",
              "null"
            ],
            "pattern": "^sha256:[0-9a-f]{64}$"
          },
          "after_digest": {
            "type": [
              "string",
              "null"
            ],
            "pattern": "^sha256:[0-9a-f]{64}$"
          }
        }
      }
    },
    "completed_scope": {
      "type": "array",
      "maxItems": 1000,
      "items": {
        "type": "object",
        "additionalProperties": false,
        "required": [
          "path"
        ],
        "properties": {
          "path": {
            "type": "string",
            "minLength": 1
          },
          "before_digest": {
            "type": [
              "string",
              "null"
            ],
            "pattern": "^sha256:[0-9a-f]{64}$"
          },
          "after_digest": {
            "type": [
              "string",
              "null"
            ],
            "pattern": "^sha256:[0-9a-f]{64}$"
          }
        }
      }
    },
    "remaining_scope": {
      "type": "array",
      "maxItems": 1000,
      "minItems": 1,
      "items": {
        "type": "object",
        "additionalProperties": false,
        "required": [
          "path"
        ],
        "properties": {
          "path": {
            "type": "string",
            "minLength": 1
          },
          "before_digest": {
            "type": [
              "string",
              "null"
            ],
            "pattern": "^sha256:[0-9a-f]{64}$"
          },
          "after_digest": {
            "type": [
              "string",
              "null"
            ],
            "pattern": "^sha256:[0-9a-f]{64}$"
          }
        }
      }
    },
    "manual_reason": {
      "type": "string",
      "minLength": 1,
      "maxLength": 200
    },
    "failure_code": {
      "type": [
        "string",
        "null"
      ],
      "enum": [
        "agent_error",
        "canceled",
        "timeout",
        "environment_error",
        null
      ]
    }
  },
  "allOf": [
    {
      "if": {
        "properties": {
          "status": {
            "const": "failed"
          }
        },
        "required": [
          "status"
        ]
      },
      "then": {
        "properties": {
          "failure_code": {
            "enum": [
              "agent_error",
              "canceled",
              "timeout",
              "environment_error"
            ]
          }
        },
        "required": [
          "failure_code"
        ]
      }
    },
    {
      "if": {
        "properties": {
          "status": {
            "const": "partially_completed"
          }
        },
        "required": [
          "status"
        ]
      },
      "then": {
        "required": [
          "completed_scope",
          "remaining_scope"
        ]
      }
    },
    {
      "if": {
        "properties": {
          "status": {
            "const": "blocked"
          }
        },
        "required": [
          "status"
        ]
      },
      "then": {
        "required": [
          "manual_reason"
        ]
      }
    }
  ]
}
