{
  "schema_version": "agent-dispatch.work-receipt/v1",
  "dispatch_id": "019c2234-5678-7abc-9def-0123456789ab",
  "external_task_id": "hermes-task-12345",
  "run_id": "wiki-maintenance-run-001",
  "resource_id": "vault-main",
  "status": "completed",
  "base_revision": "git:abc123",
  "result_revision": "git:def456",
  "submitted_at": "2026-08-19T03:30:00+09:00",
  "changes": [
    {
      "path": "Indexes/inbox-index.md",
      "before_digest": "sha256:1111111111111111111111111111111111111111111111111111111111111111",
      "after_digest": "sha256:2222222222222222222222222222222222222222222222222222222222222222"
    }
  ],
  "failure_code": null
}
